{
  "schema_version": 1,
  "approval_mode": "delegated_delivery",
  "operations": {
    "edit_phase_owned_files": true,
    "write_state_log_review_artifacts": true,
    "create_or_switch_phase_branch": true,
    "run_verification": true,
    "commit_delivered_phase_locally": true,
    "retarget_saved_automation": true,
    "pause_saved_automation": true,
    "push_current_phase_branch": true
  },
  "pause_automation_on_completion": false,
  "pause_automation_on_stall": true,
  "pause_automation_on_completion_reason": "Operator explicitly disabled this terminal safety pause during setup.",
  "never_auto": [
    "force_push",
    "git_reset_hard",
    "delete_branches_or_tags",
    "merge_or_promote_to_main",
    "publish_releases_or_packages",
    "use_unavailable_credentials",
    "change_repository_security_or_billing",
    "install_or_sync_global_tools",
    "destructive_filesystem_outside_phase_scope"
  ]
}
